song_name,og_artist,badword,kb_idx,numOccurKB,og_idx,numOccurOG,data,category,anchored,year,isCensored,isPresent,ogCase1,kbReplace1,jdCheck,forQuiz,noEdit,dropSong,replaceSong
knocks you down,Keri Hilson,damn,286,0,628,1,first,profanity,^damn,2010,1,1,But I know it feels so damn good,I used to be Commander-in-Chief,"But I know it feels so, so good",,,,
knocks you down,Keri Hilson,bullet,286,0,628,1,first,violence,^bullet,2010,1,1,She shot the bullet that ended that life (Oh),"But I know it feels so, so good",CUTS VERSE,,,,
knocks you down,Keri Hilson,shit,286,0,628,1,first,profanity,^shit,2010,1,1,I used to be commander-in-chief of my pimp shit flying high (Flying high),I never thought I'd,I used to be Commander-in-Chief of my own ship flyin' high,,,,
knocks you down,Keri Hilson,god,286,0,628,1,first,other,^god,2010,1,1,How could a goddess ask someone that's only average?,Let the wind blow the ash right before my glasses,"I'll admit it, I was scared to answer love's call",,,,
knocks you down,Keri Hilson,high,286,1,628,2,first,alcohol & drugs,^high$,2010,1,1,I used to be commander-in-chief of my pimp shit flying high (Flying high),I never thought I'd,I used to be Commander-in-Chief of my own ship flyin' high,,,,
knocks you down,Keri Hilson,pimp,286,0,628,2,first,sexual,^pimp,2010,1,1,I used to be commander-in-chief of my pimp shit flying high (Flying high),I never thought I'd,I used to be Commander-in-Chief of my own ship flyin' high,,,,
l.o.v.e,Ashlee Simpson,hell,312,1,638,2,first,profanity,^hell$,2006,1,1,I don't even know where the hell he goes,I don't even know where the heck he goes,I don't even know where the heck he goes,,,,
l.o.v.e,Ashlee Simpson,man,312,0,638,1,first,identity,^man$,2006,1,1,Don't need any man in this room,My boyfriend he'll be calling me now anytime,Don't need any boys in this room,,,,
latch,Disclosure,touch,288,0,279,1,first,sexual,^touch,2015,1,1,"I'm so encaptured, got me wrapped up in your touch",Why did you kiss me to make my heart beat out my chest?,"I’m so en-captured, got me wrapped up in you so much",,,,
lean on,Major Lazer,blow,289,10,280,14,first,alcohol & drugs,^blow,2015,1,1,"All around, the wind blows",All around the wind blows,All around the wind blows,,Y,,
lean on,Major Lazer,gun,289,0,280,12,first,violence,^gun$,2015,1,1,"Blow a kiss, fire a gun","Blow a kiss, you're the one","Blow a kiss, you're the one",,,,
lean on,Major Lazer,kiss,289,8,280,12,first,sexual,^kiss,2015,1,1,"Blow a kiss, fire a gun","Blow a kiss, you're the one","Blow a kiss, you're the one",,,,
let it rock,Kevin Rudolf,bang,292,0,282,1,first,sexual,^bang$,2009,1,1,"My aim is perfect, I'll bang ya",NA,CUTS VERSE,,,,
let it rock,Kevin Rudolf,crime,292,0,282,1,first,violence,^crime,2009,1,1,And you do your crime,And you take your time and you stand in line,And you stand in line,,,,
let it rock,Kevin Rudolf,god,292,0,282,1,first,other,^god,2009,1,1,So you pray to God to justify the way,"What is done in vain, truth is hard to swallow",So you pray a lot to justify the way you live a lie,,,,
let it rock,Kevin Rudolf,dick,292,0,282,2,first,sexual,^dick,2009,1,1,"I can dick you up, I can dick you down",NA,CUTS VERSE,,,,
let it rock,Kevin Rudolf,dirty,292,1,282,2,first,sexual,^dirty$,2009,1,1,"I see your dirty face, hide behind your collar","Let it rock, let it rock, let it rock",I see your dirty face hide behind your collar,,Y,,
let it rock,Kevin Rudolf,panties,292,0,282,1,first,sexual,^panties$,2009,1,1,"Panties drop, and the tops","Make you come alive, I can take you higher",CUTS VERSE,,,,
let it snow! let it snow! let it snow!,Frank Sinatra,blow,293,0,630,1,first,alcohol & drugs,^blow,2002,1,1,He don't care about the cold and the winds that blow,NA,,,,Y,
let's get it started,The Black Eyed Peas,thug,296,0,287,1,first,violence,^thug,2005,1,1,"At the gate, and we'll bring the thugged out drill (just)","Let's get it started, ha","Out the gate, we'll bring the bud top drill",,,,
let's get it started,The Black Eyed Peas,shit,296,0,287,1,first,profanity,^shit,2005,1,1,You wouldn't believe how we wow shit out,"Cause when we be out, girl it's gonna be that",You wouldn't believe how we wow this out,,,,
like i'm gonna lose you,Meghan Trainor,kiss,299,0,289,1,first,sexual,^kiss,2016,1,1,"So I'll kiss you longer, babe (Hey), any chance that I get","So I'll stay here longer baby, any chance that I get",,,,,
little saint nick,The Beach Boys,man,303,0,635,1,first,identity,^man$,2002,1,1,"And when Santa hits the gas, man, just watch her peel!",He's walking through the snow at a frightening speed,,,,Y,
live your life,T.I.,counterfeit,305,0,291,1,first,other,^counterfeit,2009,1,1,"Allergic to the counterfeit, impartial to the politics",NA,CUTS VERSE,,,,
live your life,T.I.,clothes,305,2,291,3,first,sexual,^clothes$,2009,1,1,"In fancy clothes, and fancy cars","Just live your life, hey",With fancy clothes and fancy cars,,,,
live your life,T.I.,crazy,305,0,291,1,first,other,^crazy$,2009,1,1,"I never been a hater, still, I love 'em in a crazy way","My life, hey, my life, oh",CUTS VERSE,,,,
live your life,T.I.,nigga,305,0,291,1,first,profanity,^nigga,2009,1,1,"Articulate, but still I'll grab a nigga by the collar quick",NA,CUTS VERSE,,,,
live your life,T.I.,piss,305,0,291,1,first,profanity,^piss,2009,1,1,Unhappy with the riches cause you're piss poor morally,NA,CUTS VERSE,,,,
live your life,T.I.,thug,305,0,291,1,first,violence,^thug,2009,1,1,"Been thuggin' all my life, can't say I don't deserve to take a break",Look in the mirror and keep on shinin',CUTS VERSE,,,,
live your life,T.I.,pray,305,0,291,1,first,other,^pray,2009,1,1,I pray for patience but they make me wanna melt they face away,Got my mind on my money and I'm not goin' away,CUTS VERSE,,,,
livin la vida loca,Ricky Martin,devil,306,3,636,4,first,other,^devil,2001,1,1,Her lips are devil red,She must've slipped me a sleeping pill,Her lips are devil red ,,Y,,
livin la vida loca,Ricky Martin,lips,306,3,636,4,first,sexual,^lips$,2001,1,1,Her lips are devil red,She must've slipped me a sleeping pill,Her lips are devil red ,,Y,,
locked out of heaven,Bruno Mars,sex,307,0,292,4,first,sexual,^sex,2013,1,1,Cause your sex takes me to paradise,But swimming in your world is something spiritual,Cause your love takes me to paradise,,,,
look what you made me do,Taylor Swift,gun,309,0,296,1,first,violence,^gun$,2018,1,1,You said the gun was mine,You said this thing was mine,You said this thing was mine,,,,
love lies,Khalid & Normani,damn,313,0,299,1,first,profanity,^damn,2019,1,1,But I've been waitin' for you for my whole damn life,But I've been waitin' for you for my whole life,But I've been waitin' for you for my whole life,,,,
love lies,Khalid & Normani,shit,313,0,299,2,first,profanity,^shit,2019,1,1,You've got some shit to say and I'm here to listen,"You've got something to say and I'm here to listen, so, baby...","You've got something to say and I'm here to listen, so, baby...",,,,
love on the brain,Rihanna,fuck,315,0,640,3,first,profanity,fuck,2017,1,1,It beats me black and blue but it fucks me so good,That's got me feeling this way,"It makes me feel it's true, but it tricks me so good",,,,
love somebody,Maroon 5,pill,316,0,301,1,first,alcohol & drugs,^pill$,2014,1,1,"And it's a hard pill for you to swallow, yeah","And it's a hard fact for you to swallow, yeah","And it's a hard fact for you to swallow, yeah",,,,
love somebody,Maroon 5,touch,316,0,301,3,first,sexual,^touch,2014,1,1,I really wanna touch somebody,I know we're only half way there,I really wanna love somebody,,,,
love yourself,Justin Bieber,sleep,319,0,304,2,first,sexual,^sleep,2016,1,1,"But now I know, I'm better sleeping on my own","And now I know, I'm better living on my own","And now I know, I'm better living on my own",,,,
makes me wonder,Maroon 5,damn,323,0,309,1,first,profanity,^damn,2007,1,1,God damn my spinning head,I wonder if it even makes a difference to try,Can't stop my spinning head,,,,
makes me wonder,Maroon 5,fuck,323,0,309,3,first,profanity,fuck,2007,1,1,And it really makes me wonder if I ever gave a fuck about you,And you don't have the time,"And it really makes me wonder, if I ever gave a thought about you",,,,
makes me wonder,Maroon 5,god,323,0,309,1,first,other,^god,2007,1,1,God damn my spinning head,I wonder if it even makes a difference to try,Can't stop my spinning head,,,,
makes me wonder,Maroon 5,thigh,323,0,309,1,first,sexual,^thigh,2007,1,1,The way it felt between your thighs,Way it felt to hearing lies,Way it felt to hearing lies,,,,
me against the music (ft. madonna),Britney Spears,sex,NA,0,312,1,first,sexual,^sex,2004,1,1,"Sexy lady, I'd rather see you bare your soul",NA,,,,Y,
me against the music (ft. madonna),Britney Spears,body,NA,0,312,2,first,sexual,^body$,2004,1,1,Just work your body (uh-huh) and let it go (Let it go),NA,,,,Y,
me against the music (ft. madonna),Britney Spears,hips,NA,0,312,1,first,sexual,^hips$,2004,1,1,My hips are movin' at a rapid pace,NA,,,,Y,
me against the music (ft. madonna),Britney Spears,hell,NA,0,312,1,first,profanity,^hell$,2004,1,1,To hell with stares,NA,,,,Y,
me love,Sean Kingston,damn,330,0,313,1,first,profanity,^damn,2008,1,1,"Damn, why my baby up and gone (Up and gone)",I feel like I'm drownin' in the ocean,Why my baby up and gone?,,,,
me love,Sean Kingston,kiss,330,0,313,1,first,sexual,^kiss,2008,1,1,We use to kiss and caress an chess me,"We use hang out an' talk, an' trust me, girl","We use hang out an' talk, an' trust me, girl",,,,
me too,Meghan Trainor,drink,332,0,314,1,first,alcohol & drugs,^drink,2016,1,1,I never pay for my drinks,I never pay for a thing,I never pay for a thing,,,,
me too,Meghan Trainor,god,332,3,314,5,first,other,^god,2016,1,1,I thank God every day (Uh-huh),I thank God every day (uh huh),I thank God every day (Uh-huh),,Y,,
me too,Meghan Trainor,sex,332,0,314,1,first,sexual,^sex,2016,1,1,Who's that sexy thang I see over there?,Who's that pretty girl I see over there?,Who's that pretty girl I see over there?,,,,
me too,Meghan Trainor,neck,332,0,314,1,first,sexual,^neck$,2016,1,1,What's that icy thang hangin' 'round my neck? Mmm,What's that icy thing hangin' 'round my neck?,What's that icy thing hangin' 'round my neck?,,,,
"me, myself and i",Beyoncé,women,NA,0,315,1,first,identity,^women$,2004,1,1,Foolish of me to compete when you cheat with loose women,NA,,,,Y,
"me, myself and i",Beyoncé,man,NA,0,315,1,first,identity,^man$,2004,1,1,So dumb and naive to believe that with me you're a changed man,NA,,,,Y,
"me, myself and i",Beyoncé,clothes,NA,0,315,1,first,sexual,^clothes$,2004,1,1,Come pick up your clothes,NA,,,,Y,
mercy,Shawn Mendes,skin,331,0,321,2,first,sexual,^skin$,2017,1,1,Ripping all the skin from off my bones,Feeling all the hurt inside my bones,Feeling all the hurt inside my bones,,,,
mi gente,J Balvin & Willy William,man,333,0,322,1,first,identity,^man$,2018,1,1,"J Balvin, man",Uh-huh,It's boppin 'now,,,,
mía (ft. drake),Bad Bunny,high,NA,0,323,2,first,alcohol & drugs,^high$,2019,1,1,"Dile que tú eres mía desde la high (Desde la high, yeh)",NA,Tell them that you are mine from high (From high),,,,
miss independent,Kelly Clarkson,man,336,1,327,2,first,identity,^man$,2003,1,1,"Miss don't let a man interfere, no","Miss don't let a men interfere, no","Miss don't let a man interfere, no",,Y,,
move it like this,Baha Men,body,340,3,330,4,first,sexual,^body$,2003,1,1,C'mon ladies rock the party Shake your body everybody,Can you move it like this? I can shake it like that,"C'mon ladies, rock the party, shake your body, everybody",,Y,,
move it like this,Baha Men,man,340,3,330,4,first,identity,^man$,2003,1,1,(move it man),Jump back and the do the twist,Yeah,,,,
moves like jagger,Maroon 5,drunk,341,0,331,3,first,alcohol & drugs,^drunk,2012,1,1,Kiss me till you're drunk and I'll show you,And I'll know you,"Dance until were done, and I'll show you",,,,
moves like jagger,Maroon 5,kiss,341,0,331,3,first,sexual,^kiss,2012,1,1,Kiss me till you're drunk and I'll show you,And I'll know you,"Dance until were done, and I'll show you",,,,
moves like jagger,Maroon 5,naked,341,0,331,1,first,sexual,^naked,2012,1,1,"I put on a show, now I'm naked",Now we're Jayden,"I put on a show, now we're Jayden",,,,
moves like jagger,Maroon 5,shit,341,0,331,1,first,profanity,^shit,2012,1,1,I don't give a shit,I don't even care,I don't even care,,,,
moves like jagger,Maroon 5,tongue,341,0,331,4,first,sexual,^tongue,2012,1,1,Take me by the tongue and I'll know you (Uh),Take me by the hand,"Take me by the hand, and I'll know you",,,,
mr. saxobeat,Alexandra Stan,dirty,342,0,332,2,first,sexual,^dirty$,2012,1,1,"My dirty boy, can't you see",NA,,,,Y,
mr. saxobeat,Alexandra Stan,sex,342,0,332,2,first,sexual,^sex,2012,1,1,"Hey, sexy boy, set me free",NA,,,,Y,
mr. saxobeat,Alexandra Stan,freak,342,0,332,8,first,sexual,^freak,2012,1,1,"Make me move like a freak, Mr. Saxobeat","Hey dance with me set with me don't be so shy dance with me hey dance with me, can't you see that you belong next to me Hey dance with me set me free don't be so shy dance with me hey dance with me, can't you see that you belong next to me",,,,Y,
my happy ending,Avril Lavigne,shit,344,0,334,2,first,profanity,^shit,2005,1,1,All the shit that you do (all the shit that you do),But so are they,All the stuff that you do?,,,,
my house,Flo Rida,clothes,345,0,335,1,first,sexual,^clothes$,2016,1,1,"Keep our clothes on the floor, open up champagne","Hang around, let's pretend that the time has changed","Keep our hands in the air, open up and dance",,,,
my house,Flo Rida,champagne,345,0,335,2,first,alcohol & drugs,^champagne$,2016,1,1,"Open up the champagne, pop!",This is how we do it!,This is how we do it! Kidz bop!,,,,
my house,Flo Rida,pour,345,0,335,1,first,alcohol & drugs,^pour,2016,1,1,"Pour yourself something cold, baby, cheers to this","Make yourself at my home, tell me where you been","Play a song, something good, come on dance to this",,,,
my house,Flo Rida,vodka,345,0,335,1,first,alcohol & drugs,^vodka,2016,1,1,"Another shot of vodka, you know what's in my glass",Mi casa es tu casa so it ain't no holding back,"Another song to move to, you know my favorite track",,,,
my love,Justin Timberlake,die,347,0,337,1,first,violence,^die$,2007,1,1,"You don't come, I ain't gon' die","You can be my baby, let me make you my lady",CUTS VERSE,,,,
my love,Justin Timberlake,man,347,0,337,4,first,identity,^man$,2007,1,1,"I don't know what you hesitatin' for, man",(So don't give away),CUTS VERSE,,,,
my love,Justin Timberlake,high,347,0,337,2,first,alcohol & drugs,^high$,2007,1,1,Cause the girls worldwide throw they hands up high,(So don't give away),CUTS VERSE,,,,
my love,Justin Timberlake,woman,347,0,337,7,first,identity,^woman$,2007,1,1,"Ain't another woman that can take your spot, my—",If I wrote you a symphony,"Ain't another girl that can take your spot, my",,,,
my love is your love,Whitney Houston,clothes,348,0,338,1,first,sexual,^clothes$,2001,1,1,"Take my clothes, for that price you can have my life",NA,,,,,https://genius.com/Whitney-houston-my-love-is-your-love-lyrics
my love is your love,Whitney Houston,guns,348,0,338,2,first,violence,^guns$,2001,1,1,And find guns on the floor,It's okay if you're coming with me,,,,,https://genius.com/Whitney-houston-my-love-is-your-love-lyrics
my love is your love,Whitney Houston,pray,348,0,338,2,first,other,^pray,2001,1,1,I pray that life don't get you stressed,And the chains of Amistad couln't hold us,,,,,https://genius.com/Whitney-houston-my-love-is-your-love-lyrics
natural,Imagine Dragons,bleed,350,0,340,1,first,violence,^bleed,2019,1,1,"Cut until it bleeds inside a world without the peace, facing","Sing until you scream, inside a world without the peace, face it","Sing until you scream, inside a world without the peace, face it",,,,
natural,Imagine Dragons,blood,350,0,340,1,first,violence,^blood,2019,1,1,"Took an oath by the blood of my hand, won't break it","Took an oath by the palm of my hand, won't break it","Took an oath by the palm of my hand, won't break it",,,,
natural,Imagine Dragons,cut,350,0,340,1,first,violence,^cut$,2019,1,1,"Cut until it bleeds inside a world without the peace, facing","Sing until you scream, inside a world without the peace, face it","Sing until you scream, inside a world without the peace, face it",,,,
natural,Imagine Dragons,cutthroat,350,0,340,3,first,violence,^cutthroat$,2019,1,1,Living your life cutthroat,"Living your life, you know","Living your life, you know",,,,
natural,Imagine Dragons,sin,350,0,340,1,first,other,^sin$,2019,1,1,Will Heaven step in? Will it save us from our sin? Will it?,Will Heaven step in? Will it save us from within? Will it?,Will Heaven step in? Will it save us from within? Will it?,,,,
never again,Kelly Clarkson,bed,351,0,342,1,first,sexual,^bed$,2007,1,1,"I hope when you're in bed with her, you think of me",I hope that when you're out with her you think of me,I hope that when you're out with her you think of me,,,,
never again,Kelly Clarkson,die,351,0,342,1,first,violence,^die$,2007,1,1,"You'll die together, but alone",You wrote me in a letter,You'll be together but alone,,,,
never be like you (ft. kai),Flume,sleep,NA,0,343,1,first,sexual,^sleep,2016,1,1,"Hate sleeping on my own, missing the way you taste",NA,,,,Y,
never be like you (ft. kai),Flume,hell,NA,0,343,11,first,profanity,^hell$,2016,1,1,He'll never be like you,NA,,,,Y,
never be like you (ft. kai),Flume,sins,NA,0,343,2,first,other,^sins$,2016,1,1,"I'm begging, darling, please, absolve me of my sins, won't you?",NA,,,,Y,
never be like you (ft. kai),Flume,fuck,NA,0,343,6,first,profanity,fuck,2016,1,1,Now I'm fucked up and I'm missing you,NA,,,,Y,
never forget you,Zara Larsson & MNEK,die,352,13,344,17,first,violence,^die$,2016,1,1,I knew that I would love you 'til the day I die,From the day that I met you,I knew that I would love you till the day I die,,Y,,
"never leave you (uh oooh, uh oooh)",Lumidee,crazy,NA,0,345,1,first,other,^crazy$,2004,1,1,They're c-calling me crazy now,NA,,,,Y,
never really over,Katy Perry,kiss,NA,0,346,2,first,sexual,^kiss,2019,1,1,Thought we kissed goodbye,NA,Thought we kissed goodbye,,Y,,
new rules,Dua Lipa,bed,354,0,348,3,first,sexual,^bed$,2018,1,1,You know you're gonna wake up in his bed in the morning,You know you're gonna meet up with your friends in the morning,You know you're gonna meet up with your friends in the morning,,,,
new rules,Dua Lipa,drunk,354,0,348,3,first,alcohol & drugs,^drunk,2018,1,1,You know he's only callin' 'cause he's drunk and alone,You know he's only callin' 'cause he's sad and alone,You know he's only callin' 'cause he's sad and alone,,,,
new rules,Dua Lipa,sleep,354,1,348,2,first,sexual,^sleep,2018,1,1,"Talkin' in my sleep at night, makin' myself crazy","Talkin' in my sleep at night, makin' myself crazy","Talkin' in my sleep at night, makin' myself crazy",,Y,,
no,Meghan Trainor,hips,355,0,643,3,first,sexual,^hips$,2016,1,1,Lick your lips and swing your hips,"Girl, all you gotta say is","Move your lips, say it how it is",,,,
no,Meghan Trainor,man,355,0,643,2,first,identity,^man$,2016,1,1,"If I want a man, then I'ma get a man","Nah, to the ah, to the no, no, no","If I wanna dance, then I'mma go dance",,,,
no air,Jordin Sparks,die,356,0,349,1,first,violence,^die$,2008,1,1,If I should die before I wake,"No air, air",If I should fly before I wake,,,,
no brainer,DJ Khaled,bitch,357,0,644,2,first,profanity,^bitch,2018,1,1,"But we in this bitch, bitch, I'm not no lame",Your presence is critical,CUTS VERSE,,,,
no brainer,DJ Khaled,blow,357,0,644,1,first,alcohol & drugs,^blow,2018,1,1,I blow the brains outta your mind (Ooh),And I ain't talkin' 'bout typically (No),We'll make you feel outta your mind (Ooh),,,,
no brainer,DJ Khaled,high,357,10,644,15,first,alcohol & drugs,^high$,2018,1,1,Put 'em high,Put 'em high (Put 'em high),Put 'em high,,Y,,
no brainer,DJ Khaled,damn,357,0,644,1,first,profanity,^damn,2018,1,1,I'll be your excuse (Damn right),NA,I'll be your excuse (Yeah right),,,,
no brainer,DJ Khaled,god,357,0,644,1,first,other,^god,2018,1,1,She told me that she love that I make music for God,"You stick out of the crowd, baby, it's a no-brainer",CUTS VERSE,,,,
no promises,Cheat Codes,cuttin,360,0,352,1,first,violence,^cuttin,2018,1,1,"Cutting me up like a knife and I feel it, deep in my bones",Cut me right up in my love,"Cut me right up in my love and I feel it, deep in my bones",,,,
no promises,Cheat Codes,knife,360,0,352,1,first,violence,^knife,2018,1,1,"Cutting me up like a knife and I feel it, deep in my bones",Cut me right up in my love,"Cut me right up in my love and I feel it, deep in my bones",,,,
not a bad thing,Justin Timberlake,bleed,361,0,645,2,first,violence,^bleed,2014,1,1,Now you're bleeding,When someone breaks your heart open with a light and you're hurting,And you're hurting,,,,
not a bad thing,Justin Timberlake,cuts,361,0,645,2,first,violence,^cuts$,2014,1,1,When someone cuts your heart open with a knife,Then they turn right around and break them,When someone breaks your heart open with a light,,,,
not a bad thing,Justin Timberlake,knife,361,0,645,2,first,violence,^knife,2014,1,1,When someone cuts your heart open with a knife,Then they turn right around and break them,When someone breaks your heart open with a light,,,,
not a bad thing,Justin Timberlake,fuck,361,0,645,3,first,profanity,fuck,2014,1,1,Cause you might fuck around and find your dreams come true with me,Cause you might look around and find your dreams come true with me,Cause you might look around and find your dreams come true with me,,,,
nothin' on you,B.o.B,hell,363,0,646,1,first,profanity,^hell$,2010,1,1,Most of it really was for the hell of the fun,And so I lost more than I had ever won,Most of it really was for the love of the fun,,,,
nothin' on you,B.o.B,skirt,363,0,646,1,first,sexual,skirt,2010,1,1,"Tryna chase skirts, livin' in the summer sun","I'm thinkin', ""Maybe I should get it out""",Tryna' chase dreams livin' in the summer sun,,,,
obsession (no es amor) (ft. baby bash),Frankie J,freak,NA,0,356,3,first,sexual,^freak,2005,1,1,I love the way you freaky like that,NA,,,,Y,
obsession (no es amor) (ft. baby bash),Frankie J,bless,NA,0,356,1,first,other,^bless,2005,1,1,You're my blessin' when I'm stressin',NA,,,,Y,
obsession (no es amor) (ft. baby bash),Frankie J,bed,NA,0,356,1,first,sexual,^bed$,2005,1,1,I'm tossin' turning in my bed,NA,,,,Y,
obsession (no es amor) (ft. baby bash),Frankie J,damn,NA,0,356,1,first,profanity,^damn,2005,1,1,"Baby, you so damn independent",NA,,,,Y,
obsession (no es amor) (ft. baby bash),Frankie J,man,NA,0,356,1,first,identity,^man$,2005,1,1,Now I don't care if you got a man,NA,,,,Y,
obsession (no es amor) (ft. baby bash),Frankie J,sleep,NA,0,356,2,first,sexual,^sleep,2005,1,1,And I still can't sleep,NA,,,,Y,
obsession (no es amor) (ft. baby bash),Frankie J,crazy,NA,0,356,1,first,other,^crazy$,2005,1,1,But it's driving me so crazy,NA,,,,Y,
old town road,Lil Nas X,boob,366,0,358,1,first,sexual,^boob,2019,1,1,Bull ridin' and boobies,My life is a movie,Bull ridin' and bougie,,,,https://genius.com/Lil-nas-x-old-town-road-lyrics
old town road,Lil Nas X,booty,366,0,358,1,first,sexual,^booty,2019,1,1,Wrangler on my booty,Cowboy hat from Gucci,Wrangler like on TV,,,,https://genius.com/Lil-nas-x-old-town-road-lyrics
old town road,Lil Nas X,bras,366,0,358,1,first,sexual,^bras$,2019,1,1,Baby's got a habit: diamond rings and Fendi sports bras,NA,,,,,https://genius.com/Lil-nas-x-old-town-road-lyrics
old town road,Lil Nas X,man,366,0,358,1,first,identity,^man$,2019,1,1,I'm like a Marlboro Man so I kick on back,NA,,,,,https://genius.com/Lil-nas-x-old-town-road-lyrics
on my mind,Ellie Goulding,pour,374,0,359,6,first,alcohol & drugs,^pour,2016,1,1,"Poured it down, so I poured it down",Next thing that I know I’m laying out there with you,Kept it down so I kept it down,,,,
on my mind,Ellie Goulding,tattoo,374,0,359,1,first,other,^tattoo,2016,1,1,You wanted my heart but I just liked your tattoos,And I just felt so confused,"You wanted my heart, and I just felt so confused",,,,
on the floor,Jennifer Lopez,freak,375,0,360,1,first,sexual,^freak,2011,1,1,"If you're a party freak, then step on the floor (Yeah)",Dance the night away live your life and stay young on the floor,,,,Y,
on the floor,Jennifer Lopez,die,375,0,360,1,first,violence,^die$,2011,1,1,"If I am not wrong, we'll probably die on the floor",NA,,,,Y,
on the floor,Jennifer Lopez,coke,375,0,360,1,first,alcohol & drugs,^coke$,2011,1,1,All I need is some vodka and some chonky Coke,NA,,,,Y,
on the floor,Jennifer Lopez,drink,375,0,360,5,first,alcohol & drugs,^drink,2011,1,1,"Don't stop, keep it moving, put your drinks up (Woo!)",Lalalalalalalalalalalalalalaa tonight we gon be it on the floor,,,,Y,
on the floor,Jennifer Lopez,kill,375,0,360,1,first,violence,^kill,2011,1,1,"If you're a criminal, kill it on the floor",NA,,,,Y,
on the floor,Jennifer Lopez,vodka,375,0,360,1,first,alcohol & drugs,^vodka,2011,1,1,All I need is some vodka and some chonky Coke,NA,,,,Y,
on the floor,Jennifer Lopez,shit,375,0,360,2,first,profanity,^shit,2011,1,1,You know we're running shit tonight on the floor,If you're a shoostop then move it on the floor,,,,Y,
on the floor,Jennifer Lopez,sleep,375,0,360,1,first,sexual,^sleep,2011,1,1,So I don't sleep or snooze (Snooze),Put you're hands up,,,,Y,
one dance,Drake,hennessy,368,0,362,6,first,alcohol & drugs,^hennessy$,2016,1,1,Got a Hennessy in my hand,That's why I need a one dance,Got both of your hands in my hands,,,,
one dance,Drake,wine,368,0,362,7,first,alcohol & drugs,^wine$,2016,1,1,"Wine it, wine it, very long time",Got a pretty girl and she love me long time,"Love me, love me, very long time",,,,
